{
 "discipline": "WAG",
 "version": "a220831d2eee",
 "built": "2026-10-22",
 "aliases": {
  "WGW-BB-1.101-1": [
   "WAG-BB-0001"
  ],
  "USAG-BB-1.101-2": [
   "WAG-BB-0001"
  ],
  "WGW-BB-1.201-1": [
   "WAG-BB-0002"
  ],
  "WGW-BB-1.302-1": [
   "WAG-BB-0003"
  ],
  "WGW-BB-1.402-1": [
   "WAG-BB-0004"
  ],
  "USAG-BB-1.401-1": [
   "WAG-BB-0004"
  ],
  "WGW-BB-1.103-2": [
   "WAG-BB-0005"
  ],
  "WGW-BB-1.303-1": [
   "WAG-BB-0006"
  ],
  "WGW-BB-1.403-1": [
   "WAG-BB-0007"
  ],
  "USAG-BB-1.403-1": [
   "WAG-BB-0007"
  ],
  "WGW-BB-1.403-2": [
   "WAG-BB-0008"
  ],
  "USAG-BB-1.303-1": [
   "WAG-BB-0008"
  ],
  "WGW-BB-1.304-1": [
   "WAG-BB-0009"
  ],
  "USAG-BB-1.304-1": [
   "WAG-BB-0009"
  ],
  "WGW-BB-1.105-1": [
   "WAG-BB-0010"
  ],
  "USAG-BB-1.104-1": [
   "WAG-BB-0010",
   "WAG-BB-0404"
  ],
  "WGW-BB-1.305-1": [
   "WAG-BB-0011"
  ],
  "USAG-BB-1.305-1": [
   "WAG-BB-0011"
  ],
  "WGW-BB-1.305-2": [
   "WAG-BB-0012"
  ],
  "USAG-BB-1.405-1": [
   "WAG-BB-0012"
  ],
  "WGW-BB-1.405-1": [
   "WAG-BB-0013"
  ],
  "WGW-BB-1.106-1": [
   "WAG-BB-0014"
  ],
  "WGW-BB-1.207-1": [
   "WAG-BB-0015",
   "WAG-BB-0218",
   "WAG-BB-0397"
  ],
  "USAG-BB-1.107-1": [
   "WAG-BB-0015",
   "WAG-BB-0016"
  ],
  "WGW-BB-1.207-2": [
   "WAG-BB-0016"
  ],
  "WGW-BB-1.108-1": [
   "WAG-BB-0017"
  ],
  "WGW-BB-1.108-2": [
   "WAG-BB-0018"
  ],
  "USAG-BB-1.108-1": [
   "WAG-BB-0018"
  ],
  "WGW-BB-1.208-1": [
   "WAG-BB-0019"
  ],
  "WGW-BB-1.308-1": [
   "WAG-BB-0020"
  ],
  "WGW-BB-1.309-1": [
   "WAG-BB-0021"
  ],
  "USAG-BB-1.209-1": [
   "WAG-BB-0021"
  ],
  "WGW-BB-1.309-2": [
   "WAG-BB-0022"
  ],
  "USAG-BB-1.210-1": [
   "WAG-BB-0022",
   "WAG-BB-0343",
   "WAG-BB-0405",
   "WAG-BB-0406",
   "WAG-BB-0407"
  ],
  "WGW-BB-1.609-1": [
   "WAG-BB-0023"
  ],
  "USAG-BB-1.409-3": [
   "WAG-BB-0023"
  ],
  "WGW-BB-1.310-1": [
   "WAG-BB-0024"
  ],
  "WGW-BB-1.111-1": [
   "WAG-BB-0025"
  ],
  "WGW-BB-1.211-1": [
   "WAG-BB-0026"
  ],
  "USAG-BB-1.211-1": [
   "WAG-BB-0026"
  ],
  "WGW-BB-1.311-1": [
   "WAG-BB-0027"
  ],
  "WGW-BB-1.311-2": [
   "WAG-BB-0028"
  ],
  "WGW-BB-1.311-3": [
   "WAG-BB-0029"
  ],
  "WGW-BB-1.311-4": [
   "WAG-BB-0030"
  ],
  "WGW-BB-1.411-1": [
   "WAG-BB-0031"
  ],
  "WGW-BB-1.411-2": [
   "WAG-BB-0032"
  ],
  "WGW-BB-1.411-3": [
   "WAG-BB-0033"
  ],
  "WGW-BB-1.312-1": [
   "WAG-BB-0034"
  ],
  "WGW-BB-1.312-2": [
   "WAG-BB-0035"
  ],
  "WGW-BB-1.213-1": [
   "WAG-BB-0036"
  ],
  "USAG-BB-1.212-1": [
   "WAG-BB-0036"
  ],
  "WGW-BB-1.313-1": [
   "WAG-BB-0037"
  ],
  "USAG-BB-1.312-1": [
   "WAG-BB-0037"
  ],
  "WGW-BB-1.214-1": [
   "WAG-BB-0038"
  ],
  "USAG-BB-1.213-1": [
   "WAG-BB-0038",
   "WAG-BB-0408"
  ],
  "WGW-BB-1.314-1": [
   "WAG-BB-0039"
  ],
  "USAG-BB-1.313-1": [
   "WAG-BB-0039"
  ],
  "WGW-BB-1.314-2": [
   "WAG-BB-0040"
  ],
  "USAG-BB-1.408-1": [
   "WAG-BB-0040"
  ],
  "WGW-BB-1.314-3": [
   "WAG-BB-0041"
  ],
  "USAG-BB-1.308-2": [
   "WAG-BB-0041"
  ],
  "WGW-BB-1.414-1": [
   "WAG-BB-0042"
  ],
  "USAG-BB-1.313-2": [
   "WAG-BB-0042"
  ],
  "WGW-BB-1.514-1": [
   "WAG-BB-0043"
  ],
  "USAG-BB-1.513-1": [
   "WAG-BB-0043"
  ],
  "WGW-BB-1.215-1": [
   "WAG-BB-0044"
  ],
  "USAG-BB-1.214-1": [
   "WAG-BB-0044"
  ],
  "WGW-BB-1.215-2": [
   "WAG-BB-0045"
  ],
  "WGW-BB-1.315-1": [
   "WAG-BB-0046"
  ],
  "USAG-BB-1.214-2": [
   "WAG-BB-0046"
  ],
  "WGW-BB-1.615-1": [
   "WAG-BB-0047"
  ],
  "USAG-BB-1.514-5": [
   "WAG-BB-0047"
  ],
  "WGW-BB-1.416-1": [
   "WAG-BB-0048"
  ],
  "USAG-BB-1.514-1": [
   "WAG-BB-0048"
  ],
  "WGW-BB-1.516-1": [
   "WAG-BB-0049"
  ],
  "USAG-BB-1.514-2": [
   "WAG-BB-0049"
  ],
  "WGW-BB-1.616-1": [
   "WAG-BB-0050"
  ],
  "USAG-BB-1.514-3": [
   "WAG-BB-0050"
  ],
  "WGW-BB-1.716-1": [
   "WAG-BB-0051"
  ],
  "USAG-BB-1.515-3": [
   "WAG-BB-0051"
  ],
  "WGW-BB-1.317-1": [
   "WAG-BB-0052",
   "WAG-BB-0410"
  ],
  "USAG-BB-1.415-1": [
   "WAG-BB-0052",
   "WAG-BB-0053",
   "WAG-BB-0410"
  ],
  "WGW-BB-1.417-1": [
   "WAG-BB-0053"
  ],
  "WGW-BB-1.417-2": [
   "WAG-BB-0054"
  ],
  "USAG-BB-1.515-2": [
   "WAG-BB-0054"
  ],
  "WGW-BB-1.517-1": [
   "WAG-BB-0055"
  ],
  "WGW-BB-1.518-1": [
   "WAG-BB-0056"
  ],
  "USAG-BB-1.516-1": [
   "WAG-BB-0056"
  ],
  "WGW-BB-1.618-1": [
   "WAG-BB-0057"
  ],
  "WGW-BB-1.618-2": [
   "WAG-BB-0058"
  ],
  "USAG-BB-1.516-2": [
   "WAG-BB-0058"
  ],
  "WGW-BB-1.718-1": [
   "WAG-BB-0059"
  ],
  "USAG-BB-1.516-3": [
   "WAG-BB-0059"
  ],
  "WGW-BB-1.619-1": [
   "WAG-BB-0060"
  ],
  "WGW-BB-2.101-1": [
   "WAG-BB-0061"
  ],
  "USAG-BB-2.201-1": [
   "WAG-BB-0061"
  ],
  "USAG-BB-2.0 Bronze-1b": [
   "WAG-BB-0061"
  ],
  "WGW-BB-2.301-1": [
   "WAG-BB-0062"
  ],
  "WGW-BB-2.202-1": [
   "WAG-BB-0063",
   "WAG-BB-0239",
   "WAG-BB-0240",
   "WAG-BB-0241",
   "WAG-BB-0244"
  ],
  "USAG-BB-2.201-2": [
   "WAG-BB-0063"
  ],
  "WGW-BB-2.302-1": [
   "WAG-BB-0064",
   "WAG-BB-0401",
   "WAG-BB-0402"
  ],
  "WGW-BB-2.402-1": [
   "WAG-BB-0065"
  ],
  "USAG-BB-2.501-3": [
   "WAG-BB-0065"
  ],
  "WGW-BB-2.203-1": [
   "WAG-BB-0066",
   "WAG-BB-0247",
   "WAG-BB-0248",
   "WAG-BB-0249",
   "WAG-BB-0250",
   "WAG-BB-0251"
  ],
  "USAG-BB-2.202-1": [
   "WAG-BB-0066"
  ],
  "WGW-BB-2.303-1": [
   "WAG-BB-0067",
   "WAG-BB-0253",
   "WAG-BB-0254"
  ],
  "USAG-BB-2.302-2": [
   "WAG-BB-0067"
  ],
  "WGW-BB-2.403-1": [
   "WAG-BB-0068",
   "WAG-BB-0416"
  ],
  "USAG-BB-2.502-1": [
   "WAG-BB-0068"
  ],
  "WGW-BB-2.204-1": [
   "WAG-BB-0069"
  ],
  "USAG-BB-2.304-2": [
   "WAG-BB-0069"
  ],
  "WGW-BB-2.404-1": [
   "WAG-BB-0070",
   "WAG-BB-0429"
  ],
  "USAG-BB-2.404-1": [
   "WAG-BB-0070",
   "WAG-BB-0429"
  ],
  "WGW-BB-2.504-1": [
   "WAG-BB-0071"
  ],
  "USAG-BB-2.504-1": [
   "WAG-BB-0071"
  ],
  "WGW-BB-2.105-1": [
   "WAG-BB-0072"
  ],
  "USAG-BB-2.105-2": [
   "WAG-BB-0072"
  ],
  "WGW-BB-2.305-1": [
   "WAG-BB-0073",
   "WAG-BB-0245",
   "WAG-BB-0259",
   "WAG-BB-0430"
  ],
  "USAG-BB-2.305-1": [
   "WAG-BB-0073",
   "WAG-BB-0430"
  ],
  "WGW-BB-2.405-1": [
   "WAG-BB-0074",
   "WAG-BB-0538"
  ],
  "WGW-BB-2.505-1": [
   "WAG-BB-0075"
  ],
  "USAG-BB-2.507-1": [
   "WAG-BB-0075"
  ],
  "WGW-BB-2.206-1": [
   "WAG-BB-0076"
  ],
  "USAG-BB-2.301-1": [
   "WAG-BB-0076"
  ],
  "WGW-BB-2.306-1": [
   "WAG-BB-0077",
   "WAG-BB-0417",
   "WAG-BB-0433"
  ],
  "USAG-BB-2.405-1": [
   "WAG-BB-0077",
   "WAG-BB-0433"
  ],
  "WGW-BB-2.506-1": [
   "WAG-BB-0078",
   "WAG-BB-0539"
  ],
  "WGW-BB-2.107-1": [
   "WAG-BB-0079",
   "WAG-BB-0260"
  ],
  "USAG-BB-2.206-1": [
   "WAG-BB-0079"
  ],
  "WGW-BB-2.207-1": [
   "WAG-BB-0080",
   "WAG-BB-0262"
  ],
  "USAG-BB-2.306-2": [
   "WAG-BB-0080"
  ],
  "WGW-BB-2.407-1": [
   "WAG-BB-0081"
  ],
  "USAG-BB-2.506-1": [
   "WAG-BB-0081"
  ],
  "WGW-BB-2.108-1": [
   "WAG-BB-0082"
  ],
  "USAG-BB-2.207-1": [
   "WAG-BB-0082"
  ],
  "WGW-BB-2.108-2": [
   "WAG-BB-0083",
   "WAG-BB-0413"
  ],
  "USAG-BB-2.101-3": [
   "WAG-BB-0083",
   "WAG-BB-0413"
  ],
  "WGW-BB-2.208-1": [
   "WAG-BB-0084"
  ],
  "WGW-BB-2.308-1": [
   "WAG-BB-0085"
  ],
  "USAG-BB-2.407-1": [
   "WAG-BB-0085"
  ],
  "WGW-BB-2.408-1": [
   "WAG-BB-0086"
  ],
  "WGW-BB-2.408-2": [
   "WAG-BB-0087"
  ],
  "WGW-BB-2.408-3": [
   "WAG-BB-0088",
   "WAG-BB-0414"
  ],
  "USAG-BB-2.501-1": [
   "WAG-BB-0088"
  ],
  "WGW-BB-2.209-1": [
   "WAG-BB-0089"
  ],
  "USAG-BB-2.304-1": [
   "WAG-BB-0089"
  ],
  "WGW-BB-2.209-2": [
   "WAG-BB-0090"
  ],
  "WGW-BB-2.409-1": [
   "WAG-BB-0091"
  ],
  "WGW-BB-2.110-1": [
   "WAG-BB-0092"
  ],
  "WGW-BB-2.110-2": [
   "WAG-BB-0093"
  ],
  "WGW-BB-2.210-1": [
   "WAG-BB-0094"
  ],
  "USAG-BB-2.209-1": [
   "WAG-BB-0094"
  ],
  "WGW-BB-2.310-1": [
   "WAG-BB-0095"
  ],
  "USAG-BB-2.309-1": [
   "WAG-BB-0095"
  ],
  "WGW-BB-2.211-1": [
   "WAG-BB-0096",
   "WAG-BB-0275"
  ],
  "USAG-BB-2.210-1": [
   "WAG-BB-0096"
  ],
  "WGW-BB-2.311-1": [
   "WAG-BB-0097",
   "WAG-BB-0436"
  ],
  "USAG-BB-2.410-1": [
   "WAG-BB-0097",
   "WAG-BB-0436"
  ],
  "WGW-BB-2.411-1": [
   "WAG-BB-0098"
  ],
  "USAG-BB-2.510-1": [
   "WAG-BB-0098"
  ],
  "WGW-BB-2.212-1": [
   "WAG-BB-0099",
   "WAG-BB-0440",
   "WAG-BB-0442",
   "WAG-BB-0443"
  ],
  "USAG-BB-2.211-1": [
   "WAG-BB-0099",
   "WAG-BB-0440",
   "WAG-BB-0441"
  ],
  "WGW-BB-2.412-1": [
   "WAG-BB-0100",
   "WAG-BB-0445"
  ],
  "USAG-BB-2.411-1": [
   "WAG-BB-0100",
   "WAG-BB-0445"
  ],
  "WGW-BB-2.512-1": [
   "WAG-BB-0101",
   "WAG-BB-0446"
  ],
  "USAG-BB-2.511-1": [
   "WAG-BB-0101"
  ],
  "WGW-BB-3.101-1": [
   "WAG-BB-0102",
   "WAG-BB-0281",
   "WAG-BB-0282"
  ],
  "USAG-BB-3.101-1": [
   "WAG-BB-0102"
  ],
  "WGW-BB-3.201-1": [
   "WAG-BB-0103"
  ],
  "USAG-BB-3.201-1": [
   "WAG-BB-0103"
  ],
  "WGW-BB-3.401-1": [
   "WAG-BB-0104"
  ],
  "USAG-BB-3.401-1": [
   "WAG-BB-0104"
  ],
  "WGW-BB-3.501-1": [
   "WAG-BB-0105"
  ],
  "USAG-BB-3.501-1": [
   "WAG-BB-0105"
  ],
  "WGW-BB-3.302-1": [
   "WAG-BB-0106"
  ],
  "USAG-BB-3.302-1": [
   "WAG-BB-0106"
  ],
  "WGW-BB-3.402-1": [
   "WAG-BB-0107"
  ],
  "USAG-BB-3.402-1": [
   "WAG-BB-0107"
  ],
  "WGW-BB-3.403-1": [
   "WAG-BB-0108"
  ],
  "WGW-BB-3.304-1": [
   "WAG-BB-0109"
  ],
  "USAG-BB-3.303-1": [
   "WAG-BB-0109"
  ],
  "WGW-BB-3.404-1": [
   "WAG-BB-0110"
  ],
  "USAG-BB-3.403-1": [
   "WAG-BB-0110"
  ],
  "WGW-BB-3.504-1": [
   "WAG-BB-0111"
  ],
  "WGW-BB-3.305-1": [
   "WAG-BB-0112"
  ],
  "USAG-BB-3.309-1": [
   "WAG-BB-0112"
  ],
  "WGW-BB-3.405-1": [